{
  "$schema": "https://json-schema.org/draft/2020-12/schema",
  "$id": "ConquerSettings.json",
  "title": "ConquerSettings",
  "type": "array",
  "items": {
    "type": "object",
    "properties": {
      "Id": {
        "type": "integer",
        "minimum": 1,
        "maximum": 9,
        "enum": [
          1,
          2,
          3,
          4,
          5,
          6,
          7,
          8,
          9
        ]
      },
      "Name": {
        "type": "string",
        "minLength": 6,
        "maxLength": 6,
        "enum": [
          "1939.9",
          "1943.3",
          "1950.1",
          "1960.1",
          "1980.1"
        ]
      },
      "NormalId": {
        "type": "integer",
        "minimum": 0,
        "maximum": 4,
        "enum": [
          0,
          1,
          2,
          3,
          4
        ]
      },
      "Difficulty": {
        "type": "integer",
        "minimum": 0,
        "maximum": 1,
        "enum": [
          0,
          1
        ]
      },
      "StartDate": {
        "type": "array",
        "minItems": 2,
        "maxItems": 2
      },
      "Open": {
        "type": "integer",
        "minimum": 0,
        "maximum": 1,
        "enum": [
          0,
          1
        ]
      },
      "Visible": {
        "type": "integer",
        "minimum": 1,
        "maximum": 1,
        "enum": [
          1
        ]
      }
    },
    "required": [
      "Id",
      "Name",
      "NormalId",
      "Difficulty",
      "StartDate",
      "Open",
      "Visible"
    ],
    "additionalProperties": false
  }
}
