[
  {
    "Id": 1,
    "Name": "1939.9",
    "NormalId": 0,
    "Difficulty": 0,
    "StartDate": [
      1939,
      9
    ],
    "Open": 1,
    "Visible": 1
  },
  {
    "Id": 2,
    "Name": "1943.3",
    "NormalId": 0,
    "Difficulty": 0,
    "StartDate": [
      1943,
      3
    ],
    "Open": 1,
    "Visible": 1
  },
  {
    "Id": 3,
    "Name": "1950.1",
    "NormalId": 0,
    "Difficulty": 0,
    "StartDate": [
      1950,
      1
    ],
    "Open": 1,
    "Visible": 1
  },
  {
    "Id": 4,
    "Name": "1980.1",
    "NormalId": 0,
    "Difficulty": 0,
    "StartDate": [
      1980,
      1
    ],
    "Open": 1,
    "Visible": 1
  },
  {
    "Id": 5,
    "Name": "1939.9",
    "NormalId": 1,
    "Difficulty": 1,
    "StartDate": [
      1939,
      9
    ],
    "Open": 1,
    "Visible": 1
  },
  {
    "Id": 6,
    "Name": "1943.3",
    "NormalId": 2,
    "Difficulty": 1,
    "StartDate": [
      1943,
      3
    ],
    "Open": 1,
    "Visible": 1
  },
  {
    "Id": 7,
    "Name": "1950.1",
    "NormalId": 3,
    "Difficulty": 1,
    "StartDate": [
      1950,
      1
    ],
    "Open": 1,
    "Visible": 1
  },
  {
    "Id": 8,
    "Name": "1960.1",
    "NormalId": 4,
    "Difficulty": 1,
    "StartDate": [
      1960,
      1
    ],
    "Open": 1,
    "Visible": 1
  },
  {
    "Id": 9,
    "Name": "1980.1",
    "NormalId": 4,
    "Difficulty": 1,
    "StartDate": [
      1980,
      1
    ],
    "Open": 1,
    "Visible": 1
  }
]
